{
  "manifest_version": "2.0",
  "name": "hello_world",
  "version": "0.1.0",
  "description": "Minimal Dryade plugin — the smallest thing that satisfies the Plugin Protocol.",
  "required_tier": "starter",
  "author": "Dryade Examples",
  "core_version_constraint": ">=1.0.0,<2.0.0",
  "has_ui": false,
  "agents": [],
  "tools": [],
  "routes": [],
  "permissions": [],
  "api_paths": [],
  "plugin_dependencies": [],
  "tags": ["example", "starter"]
}
